{
  "$schema": "https://json-schema.org/draft/2020-12/schema",
  "$id": "https://github.com/luckydonald/base/ai/settings/sync_todos.schema.json",
  "title": "Tracked todo sync mapping (tags to projects)",
  "$defs": {
    "Project": {
      "additionalProperties": false,
      "properties": {
        "name": {
          "description": "Label, also used by --project.",
          "title": "Name",
          "type": "string"
        },
        "tags": {
          "description": "`#Tag` summary prefixes / categories that belong to this project (matched case-insensitively).",
          "items": {
            "type": "string"
          },
          "minItems": 1,
          "title": "Tags",
          "type": "array"
        },
        "todo_file": {
          "default": "ai/todos.md",
          "description": "Todo markdown file, relative to `path`.",
          "title": "Todo File",
          "type": "string"
        },
        "commit_prefix": {
          "anyOf": [
            {
              "type": "string"
            },
            {
              "type": "null"
            }
          ],
          "default": null,
          "description": "Prefix of the commit message for this project, e.g. `[sync_todo] ` for a subproject. Overrides the global one, and is itself overridden by the repo and local config; null inherits it.",
          "title": "Commit Prefix"
        },
        "no-add-to-repo-hint": {
          "default": false,
          "description": "Silences the hint to move this project's repository-internal local `path` into `sync_todos.repo.json`; true in any of the three config files counts.",
          "title": "No-Add-To-Repo-Hint",
          "type": "boolean"
        }
      },
      "required": [
        "name",
        "tags"
      ],
      "title": "Project",
      "type": "object"
    }
  },
  "additionalProperties": false,
  "properties": {
    "$schema": {
      "anyOf": [
        {
          "type": "string"
        },
        {
          "type": "null"
        }
      ],
      "default": null,
      "title": "$Schema"
    },
    "url_env": {
      "default": "SYNC_TODO_MCP_URL",
      "description": "Env var holding the MCP server URL.",
      "title": "Url Env",
      "type": "string"
    },
    "token_env": {
      "default": "SYNC_TODO_MCP_TOKEN",
      "description": "Env var holding the bare `sytd_...` token.",
      "title": "Token Env",
      "type": "string"
    },
    "env_file": {
      "anyOf": [
        {
          "type": "string"
        },
        {
          "type": "null"
        }
      ],
      "default": "ai/.env",
      "description": "Env file (relative to the git root) to load first.",
      "title": "Env File"
    },
    "commit_prefix": {
      "default": "",
      "description": "Default prefix of the commit messages, e.g. `[root] `.",
      "title": "Commit Prefix",
      "type": "string"
    },
    "calendar_id": {
      "default": 7,
      "description": "Calendar to read (7 = `TODO: Today`).",
      "title": "Calendar Id",
      "type": "integer"
    },
    "projects": {
      "items": {
        "$ref": "#/$defs/Project"
      },
      "minItems": 1,
      "title": "Projects",
      "type": "array"
    }
  },
  "required": [
    "projects"
  ],
  "type": "object"
}
